{"attempt":1,"benchmark":"swe-bench-verified","complete":true,"format":"benchmark-trace/execution-tree-v1","framework":"openhands","generated_at":"2026-08-10T02:48:09.138Z","instance_id":"scikit-learn__scikit-learn-13439","root":{"children":[{"actor":{},"boundaries":[{"event_id":"event-8b9cfead6dcb4655ab159b3670f08c72","event_type":"instance.start","occurred_at":"2026-08-10T02:36:16.343Z","origin":{"capture_method":"derived","component":"openhands.benchmark.harness"},"phase":"start","recorded_at":"2026-08-10T02:36:16.344Z","sequence":1,"status":"started","timing":{"fidelity":"not_available"}},{"event_id":"event-501d770c8d8641d5894575577e1446f7","event_type":"instance.end","occurred_at":"2026-08-10T02:48:09.119Z","origin":{"capture_method":"derived","component":"openhands.benchmark.harness"},"phase":"end","recorded_at":"2026-08-10T02:48:09.138Z","sequence":143,"status":"failed","timing":{"duration_ms":712775.857,"fidelity":"derived"}}],"children":[{"actor":{},"boundaries":[{"event_id":"event-92fabc34372e47a487f19e5d3df222dc","event_type":"attempt.start","occurred_at":"2026-08-10T02:36:16.343Z","origin":{"capture_method":"derived","component":"openhands.benchmark.harness"},"phase":"start","recorded_at":"2026-08-10T02:36:16.351Z","sequence":2,"status":"started","timing":{"fidelity":"not_available"}},{"event_id":"event-b75015ed1ea84c3fb17fe54f3c919433","event_type":"attempt.end","occurred_at":"2026-08-10T02:48:09.119Z","origin":{"capture_method":"derived","component":"openhands.benchmark.harness"},"phase":"end","recorded_at":"2026-08-10T02:48:09.128Z","sequence":142,"status":"failed","timing":{"duration_ms":712775.857,"fidelity":"derived"}}],"children":[{"actor":{},"boundaries":[{"event_id":"event-3d967a52bd9446f1bbb4ed8dd87f0351","event_type":"harness.startup_start","occurred_at":"2026-08-10T02:36:16.343Z","origin":{"capture_method":"derived","component":"openhands.benchmark.harness"},"phase":"start","recorded_at":"2026-08-10T02:36:16.359Z","sequence":3,"status":"started","timing":{"fidelity":"derived"}},{"event_id":"event-e4440dc78b534d1fa833e4475cf6b9d9","event_type":"harness.startup_end","occurred_at":"2026-08-10T02:46:25.784Z","origin":{"capture_method":"derived","component":"openhands.benchmark.harness"},"phase":"end","recorded_at":"2026-08-10T02:46:25.954Z","sequence":4,"status":"completed","timing":{"duration_ms":609441.093,"fidelity":"derived"}}],"children":[],"completeness":"complete","duration_ms":609441.093,"ended_at":"2026-08-10T02:46:25.784Z","event_family":"harness","event_type":"harness.startup_start","input":{"artifacts":[],"payload":{}},"kind":"activity","node_id":"event-3d967a52bd9446f1bbb4ed8dd87f0351","output":{"artifacts":[],"payload":{}},"overlaps_with":[],"parent_span_id":"attempt-trace-eb255ef07143407f9d0c976353fda75b","source_event_ids":["event-3d967a52bd9446f1bbb4ed8dd87f0351","event-e4440dc78b534d1fa833e4475cf6b9d9"],"source_sequences":[3,4],"span_id":"openhands-startup-trace-eb255ef07143407f9d0c976353fda75b","started_at":"2026-08-10T02:36:16.343Z","status":"completed","timing_fidelity":"derived"},{"actor":{},"boundaries":[{"event_id":"event-34da5b64de1847e0bb2384ff4203647a","event_type":"agent.execution_start","occurred_at":"2026-08-10T02:46:25.784Z","origin":{"capture_method":"derived","component":"openhands.benchmark.harness"},"phase":"start","recorded_at":"2026-08-10T02:46:25.999Z","sequence":5,"status":"started","timing":{"fidelity":"derived"}},{"event_id":"event-73da3e6927de45deb815e01cb20e79af","event_type":"agent.execution_end","occurred_at":"2026-08-10T02:48:08.485Z","origin":{"capture_method":"derived","component":"openhands.benchmark.harness"},"phase":"end","recorded_at":"2026-08-10T02:48:08.503Z","sequence":137,"status":"failed","timing":{"duration_ms":102700.091,"fidelity":"derived"}}],"children":[{"actor":{"agent_id":"agent","session_id":"0c2d8c00-fc38-47fb-8f05-fc0dc5bb366f"},"boundaries":[{"event_id":"event-cb3ff82608f645fe8bfea39f20ac58e4","event_type":"agent.session_start","occurred_at":"2026-08-10T02:46:25.784Z","origin":{"capture_method":"derived","component":"openhands.sdk.conversation.callback"},"phase":"start","recorded_at":"2026-08-10T02:46:26.009Z","sequence":6,"status":"started","timing":{"fidelity":"not_available"}},{"event_id":"event-f2a7dd98804a4545807f5b35e8f777ea","event_type":"agent.session_end","occurred_at":"2026-08-10T02:48:08.485Z","origin":{"capture_method":"derived","component":"openhands.sdk.conversation.callback"},"phase":"end","recorded_at":"2026-08-10T02:48:08.494Z","sequence":136,"status":"failed","timing":{"duration_ms":102700.091,"fidelity":"derived"}}],"children":[{"actor":{"agent_id":"agent","session_id":"0c2d8c00-fc38-47fb-8f05-fc0dc5bb366f"},"boundaries":[{"event_id":"event-8ba065b98c5445b89653b37dcd7f3c5f","event_type":"agent.state_update","occurred_at":"2026-08-10T02:46:25.784Z","origin":{"capture_method":"native_hook","component":"openhands.sdk.conversation.callback"},"phase":"instant","recorded_at":"2026-08-10T02:46:26.234Z","sequence":7,"status":"completed","timing":{"fidelity":"not_available"}}],"children":[],"completeness":"instant","data":{"artifacts":[{"encoding":"utf-8","media_type":"application/json","path":"artifacts/sha256/84/84e3110768ecf19eddf5a4fbbe0bf274297c80844edce801b19f3b867ae7dd45","redaction":{"matches":53,"rules":["field.credential","credential.uri_password","credential.assignment","credential.authorization","field.accounting"],"status":"applied"},"role":"agent.state_update","sha256":"84e3110768ecf19eddf5a4fbbe0bf274297c80844edce801b19f3b867ae7dd45","size_bytes":388289}],"payload":{"key":"full_state"}},"duration_ms":0.0,"ended_at":"2026-08-10T02:46:25.784Z","event_family":"agent","event_type":"agent.state_update","kind":"instant","node_id":"event-8ba065b98c5445b89653b37dcd7f3c5f","overlaps_with":[],"parent_span_id":"openhands-session-0c2d8c00-fc38-47fb-8f05-fc0dc5bb366f","source_event_ids":["event-8ba065b98c5445b89653b37dcd7f3c5f"],"source_sequences":[7],"span_id":"openhands-event-bec84d97-af3e-4683-97fc-9f0f4f29a327","started_at":"2026-08-10T02:46:25.784Z","status":"completed","timing_fidelity":"not_available"},{"actor":{"agent_id":"agent","session_id":"0c2d8c00-fc38-47fb-8f05-fc0dc5bb366f"},"boundaries":[{"event_id":"event-df2eb7dc6bb74e19a0ebf47f6299ed5e","event_type":"agent.system_prompt","occurred_at":"2026-08-10T02:46:36.973Z","origin":{"capture_method":"native_hook","component":"openhands.sdk.conversation.callback"},"phase":"instant","recorded_at":"2026-08-10T02:46:37.387Z","sequence":8,"status":"completed","timing":{"fidelity":"not_available"}}],"children":[],"completeness":"instant","data":{"artifacts":[{"encoding":"utf-8","media_type":"application/json","path":"artifacts/sha256/6f/6fbb8354f04a53622c0feef473ea3dac26ce837b7796ad16cdc8a8717592c978","redaction":{"matches":2,"rules":["credential.assignment"],"status":"applied"},"role":"agent.system_prompt","sha256":"6fbb8354f04a53622c0feef473ea3dac26ce837b7796ad16cdc8a8717592c978","size_bytes":46532}],"payload":{}},"duration_ms":0.0,"ended_at":"2026-08-10T02:46:36.973Z","event_family":"agent","event_type":"agent.system_prompt","kind":"instant","node_id":"event-df2eb7dc6bb74e19a0ebf47f6299ed5e","overlaps_with":[],"parent_span_id":"openhands-session-0c2d8c00-fc38-47fb-8f05-fc0dc5bb366f","source_event_ids":["event-df2eb7dc6bb74e19a0ebf47f6299ed5e"],"source_sequences":[8],"span_id":"openhands-event-0c8a171c-c3a8-42ed-a2d8-095b28bf5d09","started_at":"2026-08-10T02:46:36.973Z","status":"completed","timing_fidelity":"not_available"},{"actor":{"agent_id":"agent","session_id":"0c2d8c00-fc38-47fb-8f05-fc0dc5bb366f"},"boundaries":[{"event_id":"event-8769f9fe0a074dffa299617eb391aa88","event_type":"agent.message","occurred_at":"2026-08-10T02:46:36.982Z","origin":{"capture_method":"native_hook","component":"openhands.sdk.conversation.callback"},"phase":"instant","recorded_at":"2026-08-10T02:46:37.843Z","sequence":9,"status":"completed","timing":{"fidelity":"not_available"}}],"children":[],"completeness":"instant","data":{"artifacts":[{"encoding":"utf-8","media_type":"application/json","path":"artifacts/sha256/61/61f4a7e9772b15cb368e574fdc17349a8d464ab3d673194496bce03e5017bbcb","redaction":{"matches":1,"rules":["credential.assignment"],"status":"applied"},"role":"agent.message","sha256":"61f4a7e9772b15cb368e574fdc17349a8d464ab3d673194496bce03e5017bbcb","size_bytes":10784}],"payload":{"source":"user"}},"duration_ms":0.0,"ended_at":"2026-08-10T02:46:36.982Z","event_family":"agent","event_type":"agent.message","kind":"instant","node_id":"event-8769f9fe0a074dffa299617eb391aa88","overlaps_with":[],"parent_span_id":"openhands-session-0c2d8c00-fc38-47fb-8f05-fc0dc5bb366f","source_event_ids":["event-8769f9fe0a074dffa299617eb391aa88"],"source_sequences":[9],"span_id":"openhands-event-897ae2ed-9319-4a07-b685-592dfc02ff20","started_at":"2026-08-10T02:46:36.982Z","status":"completed","timing_fidelity":"not_available"},{"actor":{"agent_id":"agent","session_id":"0c2d8c00-fc38-47fb-8f05-fc0dc5bb366f"},"boundaries":[{"event_id":"event-d92505c89e8f4c09a90b95a218ee6e03","event_type":"model.turn_start","occurred_at":"2026-08-10T02:46:36.982Z","origin":{"capture_method":"native_hook","component":"openhands.sdk.conversation.callback"},"phase":"start","recorded_at":"2026-08-10T02:46:37.854Z","sequence":10,"status":"started","timing":{"fidelity":"derived"}},{"event_id":"event-05b8ea3bc22f4ef7a05886fd63cc5905","event_type":"model.turn_end","occurred_at":"2026-08-10T02:46:41.948Z","origin":{"capture_method":"native_hook","component":"openhands.sdk.conversation.callback"},"phase":"end","recorded_at":"2026-08-10T02:46:42.004Z","relations":[{"event_id":"event-d92505c89e8f4c09a90b95a218ee6e03","type":"caused_by"}],"sequence":13,"status":"completed","timing":{"duration_ms":4965.694,"fidelity":"derived"}}],"children":[],"completeness":"complete","duration_ms":4965.694,"ended_at":"2026-08-10T02:46:41.948Z","event_family":"model","event_type":"model.turn_start","input":{"artifacts":[],"payload":{"boundary"